{
  "schema_version": "1.0",
  "profile_id": "virtual_humanoid_44_v1",
  "status": "software_kinematic_reference_NOT_manufacturing_design",
  "coordinate_system": {
    "handedness": "right",
    "x": "forward",
    "y": "left",
    "z": "up",
    "length": "m",
    "angle": "rad",
    "quaternion": "xyzw_hamilton_active",
    "vectors": "column"
  },
  "neutral_pose": "N_pose_arms_down_palms_forward_legs_down_feet_forward",
  "notes_zh": [
    "尺寸、轴排列和关节范围是软件验证假设，不是人体医学范围或已验证的可打印结构。",
    "三轴关节在本配置中共点；实现必须支持 parent_to_axis 与 axis_to_child 的非零偏移。",
    "全部旋转按 nodes 列表中的父子链依次求值，不能把轴角当作UE的Pitch/Yaw/Roll直接复制。",
    "side=left/right 指人偶自身左右，不是屏幕左右。",
    "44路不含软件场景放置6自由度，不含手指与面部。"
  ],
  "nodes": [
    {
      "id": "device_base",
      "parent": null,
      "kind": "fixed",
      "parent_to_axis": {
        "translation_m": [
          0,
          0,
          0
        ],
        "rotation_xyzw": [
          0,
          0,
          0,
          1
        ]
      },
      "axis_to_child": {
        "translation_m": [
          0,
          0,
          0
        ],
        "rotation_xyzw": [
          0,
          0,
          0,
          1
        ]
      }
    },
    {
      "id": "pelvis.yaw_frame",
      "parent": "device_base",
      "kind": "revolute",
      "axis_id": "pelvis.yaw",
      "axis_local": [
        0,
        0,
        1
      ],
      "parent_to_axis": {
        "translation_m": [
          0,
          0,
          0.235
        ],
        "rotation_xyzw": [
          0,
          0,
          0,
          1
        ]
      },
      "axis_to_child": {
        "translation_m": [
          0,
          0,
          0
        ],
        "rotation_xyzw": [
          0,
          0,
          0,
          1
        ]
      }
    },
    {
      "id": "pelvis.pitch_frame",
      "parent": "pelvis.yaw_frame",
      "kind": "revolute",
      "axis_id": "pelvis.pitch",
      "axis_local": [
        0,
        1,
        0
      ],
      "parent_to_axis": {
        "translation_m": [
          0,
          0,
          0
        ],
        "rotation_xyzw": [
          0,
          0,
          0,
          1
        ]
      },
      "axis_to_child": {
        "translation_m": [
          0,
          0,
          0
        ],
        "rotation_xyzw": [
          0,
          0,
          0,
          1
        ]
      }
    },
    {
      "id": "pelvis",
      "parent": "pelvis.pitch_frame",
      "kind": "revolute",
      "axis_id": "pelvis.roll",
      "axis_local": [
        -1,
        0,
        0
      ],
      "parent_to_axis": {
        "translation_m": [
          0,
          0,
          0
        ],
        "rotation_xyzw": [
          0,
          0,
          0,
          1
        ]
      },
      "axis_to_child": {
        "translation_m": [
          0,
          0,
          0
        ],
        "rotation_xyzw": [
          0,
          0,
          0,
          1
        ]
      }
    },
    {
      "id": "waist.yaw_frame",
      "parent": "pelvis",
      "kind": "revolute",
      "axis_id": "waist.yaw",
      "axis_local": [
        0,
        0,
        1
      ],
      "parent_to_axis": {
        "translation_m": [
          0,
          0,
          0.025
        ],
        "rotation_xyzw": [
          0,
          0,
          0,
          1
        ]
      },
      "axis_to_child": {
        "translation_m": [
          0,
          0,
          0
        ],
        "rotation_xyzw": [
          0,
          0,
          0,
          1
        ]
      }
    },
    {
      "id": "waist.pitch_frame",
      "parent": "waist.yaw_frame",
      "kind": "revolute",
      "axis_id": "waist.pitch",
      "axis_local": [
        0,
        1,
        0
      ],
      "parent_to_axis": {
        "translation_m": [
          0,
          0,
          0
        ],
        "rotation_xyzw": [
          0,
          0,
          0,
          1
        ]
      },
      "axis_to_child": {
        "translation_m": [
          0,
          0,
          0
        ],
        "rotation_xyzw": [
          0,
          0,
          0,
          1
        ]
      }
    },
    {
      "id": "waist",
      "parent": "waist.pitch_frame",
      "kind": "revolute",
      "axis_id": "waist.roll",
      "axis_local": [
        -1,
        0,
        0
      ],
      "parent_to_axis": {
        "translation_m": [
          0,
          0,
          0
        ],
        "rotation_xyzw": [
          0,
          0,
          0,
          1
        ]
      },
      "axis_to_child": {
        "translation_m": [
          0,
          0,
          0
        ],
        "rotation_xyzw": [
          0,
          0,
          0,
          1
        ]
      }
    },
    {
      "id": "chest.yaw_frame",
      "parent": "waist",
      "kind": "revolute",
      "axis_id": "chest.yaw",
      "axis_local": [
        0,
        0,
        1
      ],
      "parent_to_axis": {
        "translation_m": [
          0,
          0,
          0.045
        ],
        "rotation_xyzw": [
          0,
          0,
          0,
          1
        ]
      },
      "axis_to_child": {
        "translation_m": [
          0,
          0,
          0
        ],
        "rotation_xyzw": [
          0,
          0,
          0,
          1
        ]
      }
    },
    {
      "id": "chest.pitch_frame",
      "parent": "chest.yaw_frame",
      "kind": "revolute",
      "axis_id": "chest.pitch",
      "axis_local": [
        0,
        1,
        0
      ],
      "parent_to_axis": {
        "translation_m": [
          0,
          0,
          0
        ],
        "rotation_xyzw": [
          0,
          0,
          0,
          1
        ]
      },
      "axis_to_child": {
        "translation_m": [
          0,
          0,
          0
        ],
        "rotation_xyzw": [
          0,
          0,
          0,
          1
        ]
      }
    },
    {
      "id": "chest",
      "parent": "chest.pitch_frame",
      "kind": "revolute",
      "axis_id": "chest.roll",
      "axis_local": [
        -1,
        0,
        0
      ],
      "parent_to_axis": {
        "translation_m": [
          0,
          0,
          0
        ],
        "rotation_xyzw": [
          0,
          0,
          0,
          1
        ]
      },
      "axis_to_child": {
        "translation_m": [
          0,
          0,
          0
        ],
        "rotation_xyzw": [
          0,
          0,
          0,
          1
        ]
      }
    },
    {
      "id": "head.yaw_frame",
      "parent": "chest",
      "kind": "revolute",
      "axis_id": "head.yaw",
      "axis_local": [
        0,
        0,
        1
      ],
      "parent_to_axis": {
        "translation_m": [
          0,
          0,
          0.055
        ],
        "rotation_xyzw": [
          0,
          0,
          0,
          1
        ]
      },
      "axis_to_child": {
        "translation_m": [
          0,
          0,
          0
        ],
        "rotation_xyzw": [
          0,
          0,
          0,
          1
        ]
      }
    },
    {
      "id": "head.pitch_frame",
      "parent": "head.yaw_frame",
      "kind": "revolute",
      "axis_id": "head.pitch",
      "axis_local": [
        0,
        1,
        0
      ],
      "parent_to_axis": {
        "translation_m": [
          0,
          0,
          0
        ],
        "rotation_xyzw": [
          0,
          0,
          0,
          1
        ]
      },
      "axis_to_child": {
        "translation_m": [
          0,
          0,
          0
        ],
        "rotation_xyzw": [
          0,
          0,
          0,
          1
        ]
      }
    },
    {
      "id": "head",
      "parent": "head.pitch_frame",
      "kind": "revolute",
      "axis_id": "head.roll",
      "axis_local": [
        -1,
        0,
        0
      ],
      "parent_to_axis": {
        "translation_m": [
          0,
          0,
          0
        ],
        "rotation_xyzw": [
          0,
          0,
          0,
          1
        ]
      },
      "axis_to_child": {
        "translation_m": [
          0,
          0,
          0
        ],
        "rotation_xyzw": [
          0,
          0,
          0,
          1
        ]
      }
    },
    {
      "id": "head_tip",
      "parent": "head",
      "kind": "fixed",
      "parent_to_axis": {
        "translation_m": [
          0,
          0,
          0.05
        ],
        "rotation_xyzw": [
          0,
          0,
          0,
          1
        ]
      },
      "axis_to_child": {
        "translation_m": [
          0,
          0,
          0
        ],
        "rotation_xyzw": [
          0,
          0,
          0,
          1
        ]
      }
    },
    {
      "id": "clavicle_l.protract_frame",
      "parent": "chest",
      "kind": "revolute",
      "axis_id": "clavicle_l.protract",
      "axis_local": [
        0,
        0,
        -1
      ],
      "parent_to_axis": {
        "translation_m": [
          0,
          0.015,
          0.025
        ],
        "rotation_xyzw": [
          0,
          0,
          0,
          1
        ]
      },
      "axis_to_child": {
        "translation_m": [
          0,
          0,
          0
        ],
        "rotation_xyzw": [
          0,
          0,
          0,
          1
        ]
      }
    },
    {
      "id": "clavicle_l",
      "parent": "clavicle_l.protract_frame",
      "kind": "revolute",
      "axis_id": "clavicle_l.elevate",
      "axis_local": [
        1,
        0,
        0
      ],
      "parent_to_axis": {
        "translation_m": [
          0,
          0,
          0
        ],
        "rotation_xyzw": [
          0,
          0,
          0,
          1
        ]
      },
      "axis_to_child": {
        "translation_m": [
          0,
          0,
          0
        ],
        "rotation_xyzw": [
          0,
          0,
          0,
          1
        ]
      }
    },
    {